list,title,doi,documentPage
https://dblp.org/rec/conf/hhai/0001GS23,Leveraging Diversity in Online Interactions (Short Paper).,,https://ceur-ws.org/Vol-3456/short5-9.pdf
https://dblp.org/rec/conf/hhai/000324,Operationalising AI Governance - a Hands-on Approach to Responsible AI.,,https://ceur-ws.org/Vol-3825/keynote6-2.pdf
https://dblp.org/rec/conf/hhai/2022,"HHAI 2022: Augmenting Human Intellect - Proceedings of the First International Conference on Hybrid Human-Artificial Intelligence, Amsterdam, The Netherlands, 13-17 June 2022.",https://doi.org/10.3233/FAIA354,https://doi.org/10.3233/FAIA354
https://dblp.org/rec/conf/hhai/2023,"HHAI 2023: Augmenting Human Intellect - Proceedings of the Second International Conference on Hybrid Human-Artificial Intelligence, June 26-30, 2023, Munich, Germany.",,https://ebooks.iospress.nl/volume/hhai-2023-augmenting-human-intellect-proceedings-of-the-second-international-conference-on-hybrid-human-artificial-intelligence
https://dblp.org/rec/conf/hhai/2023w,"Proceedings of the Workshops at the Second International Conference on Hybrid Human-Artificial Intelligence co-located with (HHAI 2023), Munich, Germany, June 26-27, 2023.",,https://ceur-ws.org/Vol-3456
https://dblp.org/rec/conf/hhai/2023w,"Proceedings of the Workshops at the Second International Conference on Hybrid Human-Artificial Intelligence co-located with (HHAI 2023), Munich, Germany, June 26-27, 2023.",,https://nbn-resolving.org/urn:nbn:de:0074-3456-8
https://dblp.org/rec/conf/hhai/2024,"HHAI 2024: Hybrid Human AI Systems for the Social Good - Proceedings of the Third International Conference on Hybrid Human-Artificial Intelligence, Malmö, Sweden, 10-14 June 2024.",https://doi.org/10.3233/FAIA386,https://doi.org/10.3233/FAIA386
https://dblp.org/rec/conf/hhai/2024w,"Proceedings of the Workshops at the Third International Conference on Hybrid Human-Artificial Intelligence co-located with (HHAI 2024), Malmö, Sweden, June 10-11, 2024.",,https://ceur-ws.org/Vol-3825
https://dblp.org/rec/conf/hhai/2024w,"Proceedings of the Workshops at the Third International Conference on Hybrid Human-Artificial Intelligence co-located with (HHAI 2024), Malmö, Sweden, June 10-11, 2024.",,https://nbn-resolving.org/urn:nbn:de:0074-3825-7
https://dblp.org/rec/conf/hhai/AbramskiCLRS24,Cognitive Network Science Unveils Affective Bias in GPT Models Mirroring Math Anxiety in High-School Students.,https://doi.org/10.3233/FAIA240221,https://doi.org/10.3233/FAIA240221
https://dblp.org/rec/conf/hhai/AbramskiLRS24,LLM-Generated Word Association Norms.,https://doi.org/10.3233/FAIA240177,https://doi.org/10.3233/FAIA240177
https://dblp.org/rec/conf/hhai/AbuhaimedS22,Effective Task Allocation in Ad Hoc Human-Agent Teams.,https://doi.org/10.3233/FAIA220197,https://doi.org/10.3233/FAIA220197
https://dblp.org/rec/conf/hhai/AchonSHCGC23,'SOS TUTORÍA UC': A Diversity-Aware Application for Tutor Recommendation Based on Competence and Personality (Short Paper).,,https://ceur-ws.org/Vol-3456/short5-8.pdf
https://dblp.org/rec/conf/hhai/AdanH23,CollEagle; Tangible Human-AI Interaction for Collocated Collaboration.,https://doi.org/10.3233/FAIA230115,https://doi.org/10.3233/FAIA230115
https://dblp.org/rec/conf/hhai/AdhikariGDV24,Beyond Skills: The Role of Values in Job Seeking in the Era of Industry 5.0.,https://doi.org/10.3233/FAIA240178,https://doi.org/10.3233/FAIA240178
https://dblp.org/rec/conf/hhai/AkintundeYFCD024,Formal Specification of Actual Trust in Multiagent Systems.,https://doi.org/10.3233/FAIA240179,https://doi.org/10.3233/FAIA240179
https://dblp.org/rec/conf/hhai/AlfieriDGGS23,Ethical Preferences in the Digital World: The EXOSOUL Questionnaire.,https://doi.org/10.3233/FAIA230092,https://doi.org/10.3233/FAIA230092
https://dblp.org/rec/conf/hhai/AlfieriIMP22,Exosoul: Ethical Profiling in the Digital World.,https://doi.org/10.3233/FAIA220194,https://doi.org/10.3233/FAIA220194
https://dblp.org/rec/conf/hhai/AlfieriSDI24,In Search of Clarity: Discerning Between Human Replacement and Augmentation.,https://doi.org/10.3233/FAIA240180,https://doi.org/10.3233/FAIA240180
https://dblp.org/rec/conf/hhai/Armaselu24,Playing the Imitation Game: Human-AI Simulators in Pedagogic Design.,https://doi.org/10.3233/FAIA240181,https://doi.org/10.3233/FAIA240181
https://dblp.org/rec/conf/hhai/Aydin24,Assisting Users in Privacy Conflicts with Partially Observable Multi-Agent Reinforcement Learning.,https://doi.org/10.3233/FAIA240182,https://doi.org/10.3233/FAIA240182
https://dblp.org/rec/conf/hhai/BakkerBMBR22,A Hybrid Approach for Creating Knowledge Graphs: Recognizing Emerging Technologies in Dutch Companies.,https://doi.org/10.3233/FAIA220226,https://doi.org/10.3233/FAIA220226
https://dblp.org/rec/conf/hhai/BanaeeKNL24,Intention Recognition and Communication for Human-Robot Collaboration.,,https://ceur-ws.org/Vol-3825/short3-3.pdf
https://dblp.org/rec/conf/hhai/BerberianGP23,Communicating AI Intentions to Boost Human AI Cooperation (Short Paper).,,https://ceur-ws.org/Vol-3456/short4-2.pdf
https://dblp.org/rec/conf/hhai/BergKHGSL23,A Conceptual Model for Implementing Explainable AI by Design: Results of an Empirical Study.,https://doi.org/10.3233/FAIA230075,https://doi.org/10.3233/FAIA230075
https://dblp.org/rec/conf/hhai/Berman24,Why Do You Think This Person Is Introverted? - Towards Conversational Argumentative Explainability.,https://doi.org/10.3233/FAIA240222,https://doi.org/10.3233/FAIA240222
https://dblp.org/rec/conf/hhai/Berman24a,Argumentative Dialogue As Basis For Human-AI Collaboration.,,https://ceur-ws.org/Vol-3825/short3-2.pdf
https://dblp.org/rec/conf/hhai/BirhaneS22,The Games We Play: Critical Complexity Improves Machine Learning.,https://doi.org/10.3233/FAIA220186,https://doi.org/10.3233/FAIA220186
https://dblp.org/rec/conf/hhai/BisonZ23,Factors Impacting the Quality of User Answers on Smartphones (Short Paper).,,https://ceur-ws.org/Vol-3456/short5-2.pdf
https://dblp.org/rec/conf/hhai/BoerS24,Hybrid Intelligence for Digital Humanities.,https://doi.org/10.3233/FAIA240186,https://doi.org/10.3233/FAIA240186
https://dblp.org/rec/conf/hhai/BorovikV23,Co-Performing Music with AI: Real-Time Performance Control Using Speech and Gestures.,https://doi.org/10.3233/FAIA230097,https://doi.org/10.3233/FAIA230097
https://dblp.org/rec/conf/hhai/BosDFVBT22,"Karen, the Interrupting Customer.",https://doi.org/10.3233/FAIA220211,https://doi.org/10.3233/FAIA220211
https://dblp.org/rec/conf/hhai/BottaSG23,Personalizing Interventions with Diversity Aware Bandits (Short Paper).,,https://ceur-ws.org/Vol-3456/short5-10.pdf
https://dblp.org/rec/conf/hhai/BrinckS24,Frictional Design in Human-Robot Interaction: Delayed Movement in a Turn-Taking Game.,,https://ceur-ws.org/Vol-3825/short1-4.pdf
https://dblp.org/rec/conf/hhai/BrowneBYLA22,Trust in Clinical AI: Expanding the Unit of Analysis.,https://doi.org/10.3233/FAIA220192,https://doi.org/10.3233/FAIA220192
https://dblp.org/rec/conf/hhai/BussoAG23,A Research Infrastructure for Generating and Sharing Diversity-Aware Data (Short Paper).,,https://ceur-ws.org/Vol-3456/short5-4.pdf
https://dblp.org/rec/conf/hhai/BussoL23,A Context Model for Collecting Diversity-Aware Data (Short Paper).,,https://ceur-ws.org/Vol-3456/short5-3.pdf
https://dblp.org/rec/conf/hhai/CabitzaN22,"Open, Multiple, Adjunct. Decision Support at the Time of Relational AI.",https://doi.org/10.3233/FAIA220204,https://doi.org/10.3233/FAIA220204
https://dblp.org/rec/conf/hhai/CappuccioBMR24,An Interactive Interface for Feature Space Navigation.,https://doi.org/10.3233/FAIA240184,https://doi.org/10.3233/FAIA240184
https://dblp.org/rec/conf/hhai/CarterTS22,"A ""Mock App Store"" Interface for Virtual Privacy Assistants.",https://doi.org/10.3233/FAIA220212,https://doi.org/10.3233/FAIA220212
https://dblp.org/rec/conf/hhai/Ceard-Falkenberg22,pEncode: A Tool for Visualizing Pen Signal Encodings in Real-Time.,https://doi.org/10.3233/FAIA220217,https://doi.org/10.3233/FAIA220217
https://dblp.org/rec/conf/hhai/Chaaben24,Exploring Human-AI Collaboration and Explainability for Sustainable ML.,https://doi.org/10.3233/FAIA240209,https://doi.org/10.3233/FAIA240209
https://dblp.org/rec/conf/hhai/ChakravortiFFMS23,A Prototype Hybrid Prediction Market for Estimating Replicability of Published Work.,https://doi.org/10.3233/FAIA230093,https://doi.org/10.3233/FAIA230093
https://dblp.org/rec/conf/hhai/Chang0KOA24,Human-Centered AI for Dementia Care: Using Reinforcement Learning for Personalized Interventions Support in Eating and Drinking Scenarios.,https://doi.org/10.3233/FAIA240185,https://doi.org/10.3233/FAIA240185
https://dblp.org/rec/conf/hhai/CharalambidesM23,Intra-Organizational Communication 2.0 (Short Paper).,,https://ceur-ws.org/Vol-3456/short5-5.pdf
https://dblp.org/rec/conf/hhai/ChenSBHKS0W24,"Intelligent Support Systems for Lifestyle Change: Integrating Dialogue, Information Extraction, and Reasoning.",https://doi.org/10.3233/FAIA240223,https://doi.org/10.3233/FAIA240223
https://dblp.org/rec/conf/hhai/ChenTHJR23,Acquiring Semantic Knowledge for User Model Updates via Human-Agent Alignment Dialogues.,https://doi.org/10.3233/FAIA230077,https://doi.org/10.3233/FAIA230077
https://dblp.org/rec/conf/hhai/ChuanS23,Challenges and Findings in Creating Smart Assistants for Mixed Reality Training Apps.,https://doi.org/10.3233/FAIA230111,https://doi.org/10.3233/FAIA230111
https://dblp.org/rec/conf/hhai/ClavieSNB23,Towards Simple Hybrid Language Model Reasoning Through Human Explanations Enhanced Prompts.,https://doi.org/10.3233/FAIA230103,https://doi.org/10.3233/FAIA230103
https://dblp.org/rec/conf/hhai/CohenMCC23,Teamness and Trust in AI-Enabled Decision Support Systems (Short Paper).,,https://ceur-ws.org/Vol-3456/short4-7.pdf
https://dblp.org/rec/conf/hhai/Cooley-RussLKPR23,A Testbed for Cognitively Plausibly Bartering Agents.,https://doi.org/10.3233/FAIA230109,https://doi.org/10.3233/FAIA230109
https://dblp.org/rec/conf/hhai/CorradoGGLVZ23,Assisting the Assistant: A Cobot for Voice Customer Support.,https://doi.org/10.3233/FAIA230096,https://doi.org/10.3233/FAIA230096
https://dblp.org/rec/conf/hhai/DelobelleWB23,ResumeTailor: Improving Resume Quality Through Co-Creative Tools.,https://doi.org/10.3233/FAIA230116,https://doi.org/10.3233/FAIA230116
https://dblp.org/rec/conf/hhai/DierendonckFHHH24,Workshop on Responsible Applied Artificial InTelligence (Preface).,,https://ceur-ws.org/Vol-3825/prefaceW6.pdf
https://dblp.org/rec/conf/hhai/DoanFC23,Legal-Ethical Challenges and Technological Solutions to e-Health Data Consent in the EU.,https://doi.org/10.3233/FAIA230088,https://doi.org/10.3233/FAIA230088
https://dblp.org/rec/conf/hhai/DohK24,"""My Kind of Woman"": Analysing Gender Stereotypes in AI through The Averageness Theory and EU Law.",,https://ceur-ws.org/Vol-3825/paper4-1.pdf
https://dblp.org/rec/conf/hhai/Duarre024,Looking For Cognitive Bias In AI-Assisted Decision-Making.,,https://ceur-ws.org/Vol-3825/short1-1.pdf
https://dblp.org/rec/conf/hhai/Duarte23,Towards Responsible AI: Developing Explanations to Increase Human-AI Collaboration.,https://doi.org/10.3233/FAIA230126,https://doi.org/10.3233/FAIA230126
https://dblp.org/rec/conf/hhai/DushiNP23,Imagining the AI Landscape after the AI Act (Preface).,,https://ceur-ws.org/Vol-3456/preface1.pdf
https://dblp.org/rec/conf/hhai/DushiNP24,Imagining the AI Landscape after the AI Act (Preface).,,https://ceur-ws.org/Vol-3825/prefaceW4.pdf
https://dblp.org/rec/conf/hhai/Ed-DriouchGDM22,The Integration of Human Intelligence into Artificial Intelligence to Provide Medical Practice-Based Predictions.,https://doi.org/10.3233/FAIA220221,https://doi.org/10.3233/FAIA220221
https://dblp.org/rec/conf/hhai/EliseiHB24,RoboTrio2: Annotated Interactions of a Teleoperated Robot and Human Dyads for Data-Driven Behavioral Models.,,https://ceur-ws.org/Vol-3825/short3-1.pdf
https://dblp.org/rec/conf/hhai/EllisDSGS24,EASY-AI: sEmantic And compoSable glYphs for representing AI systems.,https://doi.org/10.3233/FAIA240187,https://doi.org/10.3233/FAIA240187
https://dblp.org/rec/conf/hhai/ErculianiBPG23,Egocentric Hierarchical Visual Semantics.,https://doi.org/10.3233/FAIA230095,https://doi.org/10.3233/FAIA230095
https://dblp.org/rec/conf/hhai/ErdoganDV24,Effective Maintenance of Computational Theory of Mind for Human-AI Collaboration.,https://doi.org/10.3233/FAIA240188,https://doi.org/10.3233/FAIA240188
https://dblp.org/rec/conf/hhai/ErdoganDVY22,Abstracting Minds: Computational Theory of Mind for Human-Agent Collaboration.,https://doi.org/10.3233/FAIA220199,https://doi.org/10.3233/FAIA220199
https://dblp.org/rec/conf/hhai/Esposito0P024,Trust in Deceptive Robots.,,https://ceur-ws.org/Vol-3825/extendedAbstract5-1.pdf
https://dblp.org/rec/conf/hhai/FabrisL24,Institutional Modelling: A Case Study of the Swedish Organ Donation System.,https://doi.org/10.3233/FAIA240224,https://doi.org/10.3233/FAIA240224
https://dblp.org/rec/conf/hhai/FarrellM23,False Hopes in Automated Abuse Detection (Short Paper).,,https://ceur-ws.org/Vol-3456/short3-1.pdf
https://dblp.org/rec/conf/hhai/Farshad23,Representation Learning for Semantic Scene Understanding.,https://doi.org/10.3233/FAIA230124,https://doi.org/10.3233/FAIA230124
https://dblp.org/rec/conf/hhai/FleinerV24,Towards Effective Management of Verbal Probability Expressions Using a Co-Learning Approach.,https://doi.org/10.3233/FAIA240189,https://doi.org/10.3233/FAIA240189
https://dblp.org/rec/conf/hhai/FontanaNMG22,Monitoring Fairness in HOLDA.,https://doi.org/10.3233/FAIA220205,https://doi.org/10.3233/FAIA220205
https://dblp.org/rec/conf/hhai/FregosiC24,A Frictional Design Approach: Towards Judicial AI and its Possible Applications.,,https://ceur-ws.org/Vol-3825/short1-2.pdf
https://dblp.org/rec/conf/hhai/FriedrichSTK22,Interactively Providing Explanations for Transformer Language Models.,https://doi.org/10.3233/FAIA220218,https://doi.org/10.3233/FAIA220218
https://dblp.org/rec/conf/hhai/GanterHHO24,Collaborative Hybrid Human AI Learning through Conceptual Exploration.,,https://ceur-ws.org/Vol-3825/tutorial.pdf
https://dblp.org/rec/conf/hhai/GeziciMBPRPG24,XAI in Healthcare.,,https://ceur-ws.org/Vol-3825/short2-1.pdf
https://dblp.org/rec/conf/hhai/GeziciMO23,The Ethical Impact Assessment of Selling Life Insurance to Titanic Passengers.,,https://ceur-ws.org/Vol-3456/paper1-3.pdf
https://dblp.org/rec/conf/hhai/GouveaTHS22,Annotating Sound Events Through Interactive Design of Interpretable Features.,https://doi.org/10.3233/FAIA220225,https://doi.org/10.3233/FAIA220225
https://dblp.org/rec/conf/hhai/GulyasBFL24,Keep Gesturing: A Game for Pragmatic Communication.,https://doi.org/10.3233/FAIA240225,https://doi.org/10.3233/FAIA240225
https://dblp.org/rec/conf/hhai/Gurcan24,LLM-Augmented Agent-Based Modelling for Social Simulations: Challenges and Opportunities.,https://doi.org/10.3233/FAIA240190,https://doi.org/10.3233/FAIA240190
https://dblp.org/rec/conf/hhai/HaliburtonGW0M24,Investigating Labeler Bias in Face Annotation for Machine Learning.,https://doi.org/10.3233/FAIA240191,https://doi.org/10.3233/FAIA240191
https://dblp.org/rec/conf/hhai/HaoTWBN24,Hybrid Intelligence for Healthcare (Preface).,,https://ceur-ws.org/Vol-3825/prefaceW2.pdf
https://dblp.org/rec/conf/hhai/HarbersHS24,Responsible AI in Practice: A Case Study on Designing a PSM Recommender.,,https://ceur-ws.org/Vol-3825/short6-5.pdf
https://dblp.org/rec/conf/hhai/Hartikainen24,Investigations to Facilitate Human-Centred AI Development in Manufacturing.,https://doi.org/10.3233/FAIA240210,https://doi.org/10.3233/FAIA240210
https://dblp.org/rec/conf/hhai/HartikainenSV24,Human-AI Collaboration in Smart Manufacturing: Key Concepts and Framework for Design.,https://doi.org/10.3233/FAIA240192,https://doi.org/10.3233/FAIA240192
https://dblp.org/rec/conf/hhai/Hettich24,What Happens to a Robotic Startup While It Evolves.,https://doi.org/10.3233/FAIA240226,https://doi.org/10.3233/FAIA240226
https://dblp.org/rec/conf/hhai/HolbrookHWMLSSA23,Investigating Human-Robot Overtrust During Crises (Short Paper).,,https://ceur-ws.org/Vol-3456/short4-5.pdf
https://dblp.org/rec/conf/hhai/Iyer22,Moral Reflection with AI - Necessary or Redundant?,https://doi.org/10.3233/FAIA220219,https://doi.org/10.3233/FAIA220219
https://dblp.org/rec/conf/hhai/Jarvela0HJMK23,Hybrid Intelligence - Human-AI Co-Evolution and Learning in Multirealities (HI).,https://doi.org/10.3233/FAIA230107,https://doi.org/10.3233/FAIA230107
https://dblp.org/rec/conf/hhai/JinB23,Review on the Application Areas of Decision-Making Algorithms in Smart Homes.,https://doi.org/10.3233/FAIA230076,https://doi.org/10.3233/FAIA230076
https://dblp.org/rec/conf/hhai/JorgeJT23,Artificial Trust for Decision-Making in Human-AI Teamwork: Steps and Challenges (Short Paper).,,https://ceur-ws.org/Vol-3456/short4-3.pdf
https://dblp.org/rec/conf/hhai/JorgeU23,MULTITTRUST - Multidisciplinary Perspectives on Human-AI Team Trust (Preface).,,https://ceur-ws.org/Vol-3456/preface4.pdf
https://dblp.org/rec/conf/hhai/Keswani23,Social Media Platform Structures and Their Implications (Short Paper).,,https://ceur-ws.org/Vol-3456/short3-3.pdf
https://dblp.org/rec/conf/hhai/KeswaniCKL23,Designing Closed-Loop Models for Task Allocation.,https://doi.org/10.3233/FAIA230072,https://doi.org/10.3233/FAIA230072
https://dblp.org/rec/conf/hhai/KimMMS24,Identifying XAI User Needs: Gaps between Literature and Use Cases in the Financial Sector.,,https://ceur-ws.org/Vol-3825/short6-6.pdf
https://dblp.org/rec/conf/hhai/KolaIJ22,Does Personalization Help? Predicting How Social Situations Affect Personal Values.,https://doi.org/10.3233/FAIA220196,https://doi.org/10.3233/FAIA220196
https://dblp.org/rec/conf/hhai/KomanderCP23,Developing and Validating Tools for the Automated Analysis and Enhancement of Online Discussions.,https://doi.org/10.3233/FAIA230120,https://doi.org/10.3233/FAIA230120
https://dblp.org/rec/conf/hhai/KoxB24,"Evaluating Generative AI Incidents: An Exploratory Vignette Study on the Role of Trust, Attitude and AI Literacy.",https://doi.org/10.3233/FAIA240194,https://doi.org/10.3233/FAIA240194
https://dblp.org/rec/conf/hhai/KoxBMTK22,Using a Virtual Reality House-Search Task to Measure Trust During Human-Agent Interaction (Demo Paper).,https://doi.org/10.3233/FAIA220214,https://doi.org/10.3233/FAIA220214
https://dblp.org/rec/conf/hhai/KrugROS23,Visualizing Deep Neural Networks with Topographic Activation Maps.,https://doi.org/10.3233/FAIA230080,https://doi.org/10.3233/FAIA230080
https://dblp.org/rec/conf/hhai/Kruijt22,Evaluation of a Coreference Resolution Model on Mention Patterns with Common Ground.,https://doi.org/10.3233/FAIA220220,https://doi.org/10.3233/FAIA220220
https://dblp.org/rec/conf/hhai/KruppSKALKKK24,Unreflected Acceptance - Investigating the Negative Consequences of ChatGPT-Assisted Problem Solving in Physics Education.,https://doi.org/10.3233/FAIA240195,https://doi.org/10.3233/FAIA240195
https://dblp.org/rec/conf/hhai/Kudina24,Ethics in AI: from Assessment Checklists to Proactive Practices.,,https://ceur-ws.org/Vol-3825/keynote6-1.pdf
https://dblp.org/rec/conf/hhai/KunnemanH22,A Sequence-Based Dialog Management Framework for Co-Regulated Dialog.,https://doi.org/10.3233/FAIA220195,https://doi.org/10.3233/FAIA220195
https://dblp.org/rec/conf/hhai/KunnemanS22,H3AI 2022: Hackathon on Hybrid Human Artificial Intelligence.,https://doi.org/10.3233/FAIA220229,https://doi.org/10.3233/FAIA220229
https://dblp.org/rec/conf/hhai/KuznetsovBS22,SpellInk: Interactive Correction of Spelling Mistakes in Handwritten Text.,https://doi.org/10.3233/FAIA220216,https://doi.org/10.3233/FAIA220216
https://dblp.org/rec/conf/hhai/Larasati23,AI in Healthcare - Reflection on Potential Harms and Impacts (Short Paper).,,https://ceur-ws.org/Vol-3456/short3-2.pdf
https://dblp.org/rec/conf/hhai/LarasatiBMAF23,An Ecology of AI - Reflections for Researchers (Preface).,,https://ceur-ws.org/Vol-3456/preface3.pdf
https://dblp.org/rec/conf/hhai/LeeA23,Deep BCI of Pain Decoding from fNIRS.,https://doi.org/10.3233/FAIA230112,https://doi.org/10.3233/FAIA230112
https://dblp.org/rec/conf/hhai/LeendersCVT22,Björn: An Interrogation Simulator.,https://doi.org/10.3233/FAIA220213,https://doi.org/10.3233/FAIA220213
https://dblp.org/rec/conf/hhai/LeeuwenSV23,Design of Responsible Hybrid Intelligence (Preface).,,https://ceur-ws.org/Vol-3456/preface2.pdf
https://dblp.org/rec/conf/hhai/LeeuwenVVR24,Building a Stronger Case: Combining Evidence and Law in Scenario-Based Bayesian Networks.,https://doi.org/10.3233/FAIA240202,https://doi.org/10.3233/FAIA240202
https://dblp.org/rec/conf/hhai/LemusKS22,An Empirical Investigation of Reliance on AI-Assistance in a Noisy-Image Classification Task.,https://doi.org/10.3233/FAIA220201,https://doi.org/10.3233/FAIA220201
https://dblp.org/rec/conf/hhai/LemusKS23,How Displaying AI Confidence Affects Reliance and Hybrid Human-AI Performance.,https://doi.org/10.3233/FAIA230087,https://doi.org/10.3233/FAIA230087
https://dblp.org/rec/conf/hhai/LendersC23,Functional Requirements for Interactive Bias-Audit Tools.,https://doi.org/10.3233/FAIA230118,https://doi.org/10.3233/FAIA230118
https://dblp.org/rec/conf/hhai/LiebersPAGS24,"""Computer, Generate!"" - Investigating User-Controlled Generation of Immersive Virtual Environments.",https://doi.org/10.3233/FAIA240196,https://doi.org/10.3233/FAIA240196
https://dblp.org/rec/conf/hhai/LiscioJM22,Identifying Context-Specific Values via Hybrid Intelligence.,https://doi.org/10.3233/FAIA220223,https://doi.org/10.3233/FAIA220223
https://dblp.org/rec/conf/hhai/LiscioLBDJLRM23,Inferring Values via Hybrid Intelligence.,https://doi.org/10.3233/FAIA230102,https://doi.org/10.3233/FAIA230102
https://dblp.org/rec/conf/hhai/LiuLR22,What Would You Like to Visit Next? - Using a Knowledge-Graph Driven Museum Guide in a Virtual Exhibition.,https://doi.org/10.3233/FAIA220215,https://doi.org/10.3233/FAIA220215
https://dblp.org/rec/conf/hhai/Malt23,Somax2 - A Distributed Co-Creative System for Human-Machine Co-Improvisation.,https://doi.org/10.3233/FAIA230106,https://doi.org/10.3233/FAIA230106
https://dblp.org/rec/conf/hhai/MancaBMZBB23,XAIProcessLens: A Counterfactual-Based Dashboard for Explainable AI in Process Industries.,https://doi.org/10.3233/FAIA230110,https://doi.org/10.3233/FAIA230110
https://dblp.org/rec/conf/hhai/MaoRWS23,A Hybrid Intelligence Approach to Training Generative Design Assistants: Partnership Between Human Experts and AI Enhanced Co-Creative Tools.,https://doi.org/10.3233/FAIA230078,https://doi.org/10.3233/FAIA230078
https://dblp.org/rec/conf/hhai/MarkosM23,An Empirical Exploration of Diversity Perception (Short Paper).,,https://ceur-ws.org/Vol-3456/short5-1.pdf
https://dblp.org/rec/conf/hhai/MarotRDCD22,Towards an AI Assistant for Power Grid Operators.,https://doi.org/10.3233/FAIA220191,https://doi.org/10.3233/FAIA220191
https://dblp.org/rec/conf/hhai/McKinlay24,Towards Value Alignment for Opaque Agents Through Concept Analysis and Inter-Agent Value Modelling.,https://doi.org/10.3233/FAIA240212,https://doi.org/10.3233/FAIA240212
https://dblp.org/rec/conf/hhai/MeerLJPVM22,HyEnA: A Hybrid Method for Extracting Arguments from Opinions.,https://doi.org/10.3233/FAIA220187,https://doi.org/10.3233/FAIA220187
https://dblp.org/rec/conf/hhai/MeerVJM24,Value-Sensitive Disagreement Analysis for Online Deliberation.,https://doi.org/10.3233/FAIA240231,https://doi.org/10.3233/FAIA240231
https://dblp.org/rec/conf/hhai/MehrotraJJT23,Building Appropriate Trust in AI: The Significance of Integrity-Centered Explanations.,https://doi.org/10.3233/FAIA230121,https://doi.org/10.3233/FAIA230121
https://dblp.org/rec/conf/hhai/MemonSIA23,Don't You Agree with My Ethics? Let's Negotiate!,https://doi.org/10.3233/FAIA230105,https://doi.org/10.3233/FAIA230105
https://dblp.org/rec/conf/hhai/MercadoHBGGC23,Social Interactions Mediated by the Internet and the Big- Five: A Cross-Country Analysis (Short Paper).,,https://ceur-ws.org/Vol-3456/short5-6.pdf
https://dblp.org/rec/conf/hhai/MethnaniLD24,The Impact of Mixed-Initiative on Collaboration in Hybrid AI.,https://doi.org/10.3233/FAIA240227,https://doi.org/10.3233/FAIA240227
https://dblp.org/rec/conf/hhai/MettaGYGR22,Exemplars and Counterexemplars Explanations for Skin Lesion Classifiers.,https://doi.org/10.3233/FAIA220209,https://doi.org/10.3233/FAIA220209
https://dblp.org/rec/conf/hhai/MeulenVD24,Common Ground Provides a Mental Shortcut in Agent-Agent Interaction.,https://doi.org/10.3233/FAIA240201,https://doi.org/10.3233/FAIA240201
https://dblp.org/rec/conf/hhai/Meyer-VitaliM23,Causing Intended Effects in Collaborative Decision-Making (Short Paper).,,https://ceur-ws.org/Vol-3456/short4-1.pdf
https://dblp.org/rec/conf/hhai/Meyer-VitaliM24,Human-AI Engineering for Adults.,https://doi.org/10.3233/FAIA240197,https://doi.org/10.3233/FAIA240197
https://dblp.org/rec/conf/hhai/MichaelGH23,Diversity-Aware Hybrid Human-Artificial Intelligence (Preface).,,https://ceur-ws.org/Vol-3456/preface5.pdf
https://dblp.org/rec/conf/hhai/MoruzziFR24,"Biases, Epistemic Filters, and Explainable Artificial Intelligence.",,https://ceur-ws.org/Vol-3825/short1-3.pdf
https://dblp.org/rec/conf/hhai/MulderKML24,Rogue Algorithms: Using AI to Track the Spread of Disinformation Applications.,,https://ceur-ws.org/Vol-3825/short6-3.pdf
https://dblp.org/rec/conf/hhai/MuscatoBGPG24,Multi-Perspective Stance Detection.,,https://ceur-ws.org/Vol-3825/short6-4.pdf
https://dblp.org/rec/conf/hhai/NaggitaA23,The Equity Framework: Fairness Beyond Equalized Predictive Outcomes.,https://doi.org/10.3233/FAIA230083,https://doi.org/10.3233/FAIA230083
https://dblp.org/rec/conf/hhai/Namee24,Explainable Interactive Machine Learning Using Prototypical Part Networks for Medical Image Analysis.,https://doi.org/10.3233/FAIA240214,https://doi.org/10.3233/FAIA240214
https://dblp.org/rec/conf/hhai/NarettoMG22,Privacy Risk of Global Explainers.,https://doi.org/10.3233/FAIA220206,https://doi.org/10.3233/FAIA220206
